{
  "schema_version": "1.0.0",
  "venue": "polymarket",
  "wallet": "0x8f7a2b1c3d4e5f6a7b8c9d0e1f2a3b4c5d6e7f80",
  "condition_id": "0x9c1a7f3e5d2b8c4a6f0e9d1c3b5a7f2e4d6c8b0a9f1e3d5c7b2a4f6e8d0c1b3a",
  "outcome_token_id": "71321045679188491511466125638937967989095212255543834095860404600128",
  "outcome_name": "Yes",
  "outcome_index": 0,
  "size": "1500.5",
  "avg_price": "0.34",
  "cur_price": "0",
  "initial_value": "510.17",
  "current_value": "0",
  "cash_pnl": "-510.17",
  "percent_pnl": "-100",
  "realized_pnl": "0",
  "total_bought": "1500.5",
  "redeemable": true,
  "neg_risk": false,
  "title": "Will the thing happen by December 31?",
  "slug": "will-the-thing-happen-by-december-31",
  "event_slug": "the-thing-2026",
  "end_date": "2026-12-31T23:59:59Z",
  "captured_at": "2026-08-01T09:00:00Z"
}
